title,media,date,datetime,desc,link,img,textBlob polarity,textBlob subjectivity,vader polarity
'Sweet Home' scores a home run with its creative monsters ...,The Star Online,48 mins ago,2020-12-24 16:00:24.691220,"New drama Sweet Home, which is based on a popular webtoon, is unlike most TV shows from South Korea. Far from looking pristine, featuring lush ...",https://www.thestar.com.my/lifestyle/entertainment/2020/12/24/korean-drama-039sweet-home039-scores-a-home-run-with-its-creative-monsters-and-metaphors,"data:image/gif;base64,R0lGODlhAQABAIAAAP///////yH5BAEKAAEALAAAAAABAAEAAAICTAEAOw==",0.425,0.825,0.7096
Studio Dragon Creates Relatable Korean Dramas For A Global Audience,Forbes,19 hours ago,2020-12-23 21:48:27.110867,"Studio Dragon is where much of the k-drama magic happens. The company produced the hit drama The King: The Eternal Monarch, starring Lee Min-ho and Kim ...",https://www.forbes.com/sites/joanmacdonald/2020/12/23/studio-dragon-creates-relatable-korean-dramas-for-a-global-audience/,"data:image/gif;base64,R0lGODlhAQABAIAAAP///////yH5BAEKAAEALAAAAAABAAEAAAICTAEAOw==",0.0,0.0,0.2732
Every K-Drama Series on Netflix in 2020,What's on Netflix,1 day ago,2020-12-23 16:48:29.508962,"Netflix is fast becoming the global home for K-Dramas, and over the past few years the streaming service has stepped up its output of K-Drama content.",https://www.whats-on-netflix.com/what-to-watch/every-k-drama-series-on-netflix-in-2020/,"data:image/gif;base64,R0lGODlhAQABAIAAAP///////yH5BAEKAAEALAAAAAABAAEAAAICTAEAOw==",0.0,0.0,0.0
Cross-cultural understanding - Korean drama producer's success key in Indonesia,Korea Times,1 day ago,2020-12-23 16:48:29.499018,"Park Sung-soo, after spending his teenage years in Indonesia and going to college in Korea, developed the business acumen to produce the first web drama ...",https://www.koreatimes.co.kr/www/art/2020/12/398_301251.html,"data:image/gif;base64,R0lGODlhAQABAIAAAP///////yH5BAEKAAEALAAAAAABAAEAAAICTAEAOw==",0.15,0.5,0.5719
Kim Seon Ho talks about his portrayal of Han Ji Pyeong in ...,The Independent,1 day ago,2020-12-23 16:48:27.112891,"Kim Seon Ho talks about his portrayal of Han Ji Pyeong in Korean drama, Start-Up. The Korean actor said that if he was in Ji Pyeong's shoes in real life, he would ...",https://theindependent.sg/kim-seon-ho-talks-about-his-portrayal-of-han-ji-pyeong-in-korean-drama-start-up/,"data:image/gif;base64,R0lGODlhAQABAIAAAP///////yH5BAEKAAEALAAAAAABAAEAAAICTAEAOw==",0.0,0.0,0.0
The Uncanny Counter midseason recap: characters shine in fantasy,South China Morning Post,1 day ago,2020-12-23 16:48:24.692217,"Netflix K-drama midseason recap: The Uncanny Counter – characters shine as fantasy story takes on familiar elements. So-mun, Mo-tak, Ha-na and Mae-ok, the ...",https://www.scmp.com/lifestyle/k-pop/k-drama/article/3115074/netflix-k-drama-midseason-recap-uncanny-counter-characters,"data:image/gif;base64,R0lGODlhAQABAIAAAP///////yH5BAEKAAEALAAAAAABAAEAAAICTAEAOw==",0.0,0.0,0.0
Run On episode 3: Release date and time for Netflix’s latest K-drama explained,HITC,2 days ago,2020-12-22 16:48:27.120870,"The latest Korean drama to land on Netflix is the romantic series 'Run On', but what ... it's already been a fantastic month for fans of Korean dramas on Netflix.",https://www.hitc.com/en-gb/2020/12/21/run-on-episode-3-release-date-and-time-for-netflixs-latest-k-drama-explained/,"data:image/gif;base64,R0lGODlhAQABAIAAAP///////yH5BAEKAAEALAAAAAABAAEAAAICTAEAOw==",0.5,0.9,0.0
Sweet Home: monster fun in Netflix’s hokey Korean horror show,South China Morning Post,3 days ago,2020-12-21 16:48:25.795133,"K-drama review: Sweet Home – in Netflix horror show, monster fun makes up for a hokey story. Falling somewhere between The Walking Dead, The Raid and ...",https://www.scmp.com/lifestyle/k-pop/k-drama/article/3114760/k-drama-review-sweet-home-netflix-horror-show-bloody-good,"data:image/gif;base64,R0lGODlhAQABAIAAAP///////yH5BAEKAAEALAAAAAABAAEAAAICTAEAOw==",0.32499999999999996,0.42500000000000004,0.3818
What to watch over the festive season,South China Morning Post,4 days ago,2020-12-20 16:48:27.115883,"From K-drama The Uncanny Counter to Love Actually – what to watch over the festive season. There is no shortage of festive fare to stream, including Love ...",https://www.scmp.com/magazines/post-magazine/arts-music/article/3114311/k-drama-uncanny-counter-love-actually-what-watch,"data:image/gif;base64,R0lGODlhAQABAIAAAP///////yH5BAEKAAEALAAAAAABAAEAAAICTAEAOw==",0.0,0.0,0.4588
Hot K-drama Start-Up a glimpse into how more women are ...,The Straits Times,4 days ago,2020-12-20 16:48:25.789149,"... a geeky trio of male developers to start a small company in South Korea's Silicon Valley. This may be the premise of the popular Korean drama serial Start-Up, ...",https://www.straitstimes.com/asia/east-asia/hot-k-drama-start-up-a-glimpse-into-how-more-women-are-venturing-into-south-koreas,"data:image/gif;base64,R0lGODlhAQABAIAAAP///////yH5BAEKAAEALAAAAAABAAEAAAICTAEAOw==",0.375,0.675,0.0
7 Shows Like 'True Beauty' to Watch If You Love the K-Drama,Decider,5 days ago,2020-12-19 16:48:29.504006,Share: · 'Oh My Venus' 'My ID Is Gangnam Beauty' 'Love Alarm' 'Cheese In the Trap' 'Accidentally In Love' 'Boys Over Flowers' 'It's Okay Not to Be Okay'.,https://decider.com/2020/12/18/7-shows-like-true-beauty-k-drama/,"data:image/gif;base64,R0lGODlhAQABAIAAAP///////yH5BAEKAAEALAAAAAABAAEAAAICTAEAOw==",0.425,0.625,0.9231
Hit Director Lee Eung-Bok Unleashes K-Drama Monsters In ‘Sweet Home’,Forbes,th · 6 days ago,2020-12-18 16:48:24.680249,Mr. Sunshine is set in the early 1900s and focuses on activists fighting for Korea's independence. Guardian: The Lonely and Great God is a fantasy drama about ...,https://www.forbes.com/sites/joanmacdonald/2020/12/17/hit-director-lee-eung-bok-unleashes-k-drama-monsters-in-sweet-home/,"data:image/gif;base64,R0lGODlhAQABAIAAAP///////yH5BAEKAAEALAAAAAABAAEAAAICTAEAOw==",0.35,0.65,0.0
Netflix K-Drama ‘Hospital Playlist’ Season 2 Reportedly Scheduled for Broadcast in April 2021,What's on Netflix,1 week ago,2020-12-17 16:48:29.502010,"Hospital Playlist is a licensed Netflix Original South Korean drama series directed by Shin Won Ho, and written by screenwriter Lee Woo Jung. After a run of twelve ...",https://www.whats-on-netflix.com/news/netflix-k-drama-hospital-playlist-season-2-reportedly-scheduled-for-broadcast-in-april-2021/,"data:image/gif;base64,R0lGODlhAQABAIAAAP///////yH5BAEKAAEALAAAAAABAAEAAAICTAEAOw==",0.0,0.0,0.0
6 hotspots to visit in South Korea on your next winter ...,The Straits Times,1 week ago,2020-12-17 16:48:28.382523,Yongpyong Resort is Korea's biggest ski resort and its amazing winter backdrop sets the stage for many popular Korean dramas including “Goblin: The Lonely and ...,https://www.straitstimes.com/life/travel/6-hotspots-to-visit-in-south-korea-on-your-next-winter-wonderland-getaway,"data:image/gif;base64,R0lGODlhAQABAIAAAP///////yH5BAEKAAEALAAAAAABAAEAAAICTAEAOw==",0.0,0.0,0.0
11 Best K-Dramas of 2020,TeenVogue.com,1 week ago,2020-12-17 16:48:28.376540,"Korean dramas – or K-dramas as they are more commonly called – have come a long way since my parents' days. In the 1980s and 1990s, just about every ...",https://www.teenvogue.com/story/best-k-dramas-2020,"data:image/gif;base64,R0lGODlhAQABAIAAAP///////yH5BAEKAAEALAAAAAABAAEAAAICTAEAOw==",1.0,0.3,0.6369
Crushing on K-drama actor Nam Joo-hyuk? Here's what he's ...,AsiaOne,1 week ago,2020-12-17 16:48:28.375542,"In the last few months, rising K-drama star Nam Joo-hyuk has also consistently stayed on the radar with back-to-back projects: dramas The School Nurse Files ...",https://www.asiaone.com/entertainment/crushing-k-drama-actor-nam-joo-hyuk-heres-what-hes-when-it-comes-love-and-emotions-josee,"data:image/gif;base64,R0lGODlhAQABAIAAAP///////yH5BAEKAAEALAAAAAABAAEAAAICTAEAOw==",0.4,0.9,-0.3612
Singapore taps Korean dramas,TTR Weekly,1 week ago,2020-12-17 16:48:28.371553,"SINGAPORE 15 December 2020: Singapore Tourism Board and Studio Dragon Corporation – one of South Korea's leading drama production, marketing and ...",https://www.ttrweekly.com/site/2020/12/singapore-taps-korean-dramas/,"data:image/gif;base64,R0lGODlhAQABAIAAAP///////yH5BAEKAAEALAAAAAABAAEAAAICTAEAOw==",0.0,0.0,0.0
Six accomplished women get hooked on K-Drama | Joy ...,Business Mirror,1 week ago,2020-12-17 16:48:27.119874,"I began to watch K-dramas during the lockdown and my first impression was that it is a vast conspiracy to make us crave for Korean food. Each drama has not one, ...",https://businessmirror.com.ph/2020/12/14/six-accomplished-women-get-hooked-on-k-drama/,"data:image/gif;base64,R0lGODlhAQABAIAAAP///////yH5BAEKAAEALAAAAAABAAEAAAICTAEAOw==",0.5,0.35,0.7717
"Suzy Bae wore these mule sneakers in Korean drama, Start-Up",AsiaOne,1 week ago,2020-12-17 16:48:27.118879,"South Korea. For the sake of convenience, Korean celebs have been wearing their sneakers and stepping on the heels to turn them into a slip-on. This casual ...",https://www.asiaone.com/lifestyle/suzy-bae-wore-these-mule-sneakers-korean-drama-start,"data:image/gif;base64,R0lGODlhAQABAIAAAP///////yH5BAEKAAEALAAAAAABAAEAAAICTAEAOw==",0.0,0.0,0.0
Of handsome oppas and heart-warming tales: How Korean dramas exploded on the international scene,Free Press Journal,1 week ago,2020-12-17 16:48:27.116883,"That time, it was mostly English dramas. But one day, while scrolling through the streaming platform's home page, I came across the Korean drama section, and ...",https://www.freepressjournal.in/weekend/of-handsome-oppas-and-heart-warming-tales-how-korean-dramas-exploded-on-the-international-scene,"data:image/gif;base64,R0lGODlhAQABAIAAAP///////yH5BAEKAAEALAAAAAABAAEAAAICTAEAOw==",0.25,0.5,0.4939
Where to Watch the K-Drama 'True Beauty' in the US,Decider,1 week ago,2020-12-17 16:48:25.790146,"The South Korean drama is also not available on platforms like Hulu, Google Play, Prime Video or HBO. WILL TRUE BEAUTY BE ON NETFLIX? Netflix has not ...",https://decider.com/2020/12/16/where-to-watch-kdrama-true-beauty/,"data:image/gif;base64,R0lGODlhAQABAIAAAP///////yH5BAEKAAEALAAAAAABAAEAAAICTAEAOw==",0.35,0.65,0.765
Korean actor Lee Jin-wook goes 'beast-mode' in new K-drama ...,The Star Online,1 week ago,2020-12-17 16:48:24.682244,"K-drama actor Lee Jin-wook, a heartthrob in series like Nine – 9 Times Time Travel and Voice 2 – is hardly recognisable in the new show Sweet Home.",https://www.thestar.com.my/lifestyle/entertainment/2020/12/17/korean-actor-lee-jin-wook-goes-on-039beast-mode039-in-new-k-drama-039sweet-home039,"data:image/gif;base64,R0lGODlhAQABAIAAAP///////yH5BAEKAAEALAAAAAABAAEAAAICTAEAOw==",0.13636363636363635,0.45454545454545453,0.0
Monsters are part of the draw on sci-fi K-drama Sweet Home,The Straits Times,1 week ago,2020-12-17 16:48:21.385349,"SINGAPORE - The stars of upcoming science-fiction K-drama Sweet Home, which premieres on Netflix on Dec 18, had to go through rigorous workouts and ...",https://www.straitstimes.com/life/entertainment/monsters-are-part-of-the-draw-on-sci-fi-k-drama-sweet-home,"data:image/gif;base64,R0lGODlhAQABAIAAAP///////yH5BAEKAAEALAAAAAABAAEAAAICTAEAOw==",0.35,0.65,0.4588
The role of ramyun in Korean dramas,Rappler,2 weeks ago,2020-12-10 16:48:29.506997,"If you've been a longtime K-drama fan, you'll know that popular dramas have a formulaic quality and make-or-break tropes. And elevating and subverting these ...",https://www.rappler.com/brandrap/travel-and-food/ramyun-noodles-role-korean-drama-shows,"data:image/gif;base64,R0lGODlhAQABAIAAAP///////yH5BAEKAAEALAAAAAABAAEAAAICTAEAOw==",0.0,0.0,0.0
"Netflix K-Drama ‘Run On’ Season 1: Plot, Cast, Trailer & Episode Release Dates",What's on Netflix,2 weeks ago,2020-12-10 16:48:29.505002,"Coming to Netflix this December is one of the last jTBC dramas of 2020, Run On. We have everything you need to know about the upcoming K-Drama, including ...",https://www.whats-on-netflix.com/news/netflix-k-drama-run-on-season-1-plot-cast-trailer-episode-release-dates/,"data:image/gif;base64,R0lGODlhAQABAIAAAP///////yH5BAEKAAEALAAAAAABAAEAAAICTAEAOw==",0.0,0.0,0.0
"Ramen, skincare, BTS and K-dramas… A look at the rise of Korean culture in India",afaqs,2 weeks ago,2020-12-10 16:48:29.503008,"Ever since the Coronavirus pandemic struck, OTT platforms have seen an increased spike in interest for streaming Korean dramas. These shows have a wide ...",https://www.afaqs.com/news/mktg/ramen-skincare-bts-and-k-dramas-a-look-at-the-rise-of-korean-culture-in-india,"data:image/gif;base64,R0lGODlhAQABAIAAAP///////yH5BAEKAAEALAAAAAABAAEAAAICTAEAOw==",0.0,0.0,0.0
4 most popular Korean dramas on Netflix you must watch if you haven’t caught up with the trend yet,GQ India,2 weeks ago,2020-12-10 16:48:29.501011,"The year 2020 saw people in India riding quite high on the Korean wave. From BTS, BlackPink to K-dramas we've taken a liking to them all. And when it comes ...",https://www.gqindia.com/binge-watch/collection/4-most-popular-korean-dramas-on-netflix-you-must-watch-if-you-havent-caught-up-with-the-trend-yet/,"data:image/gif;base64,R0lGODlhAQABAIAAAP///////yH5BAEKAAEALAAAAAABAAEAAAICTAEAOw==",0.55,0.7,0.4754
"Han Ji Pyeong, Choi Young Do, Kim Jung Hwan: Are Korean drama second lead syndromes overrated?",PINKVILLA,2 weeks ago,2020-12-10 16:48:29.498024,"Han Ji Pyeong, Choi Young Do, Kim Jung Hwan: Are Korean drama second ... 9 out of 10 K-Dramas feature a male lead, a female lead, a second male lead and ...",https://www.pinkvilla.com/entertainment/han-ji-pyeong-choi-young-do-kim-jung-hwan-are-korean-drama-second-lead-syndromes-overrated-581586,"data:image/gif;base64,R0lGODlhAQABAIAAAP///////yH5BAEKAAEALAAAAAABAAEAAAICTAEAOw==",0.05,0.2,0.0
Korean remake of popular Chinese drama 'A Love So Beautiful' coming soon,Korea Times,2 weeks ago,2020-12-10 16:48:28.380529,"By Dong Sun-hwa ""A Love So Beautiful,"" a Korean rendition of the Chinese drama of the same name, is coming soon. Streaming service Kakao TV unveiled ...",https://www.koreatimes.co.kr/www/art/2020/12/688_300492.html,"data:image/gif;base64,R0lGODlhAQABAIAAAP///////yH5BAEKAAEALAAAAAABAAEAAAICTAEAOw==",0.48750000000000004,0.625,0.9184
Shin Min-a before the fame: from MV extra to high-paid model,South China Morning Post,2 weeks ago,2020-12-10 16:48:28.379531,"News came earlier this year that production of Here, a highly anticipated K-drama, had to be pushed back due to the pandemic. That left fans of its star Shin ...",https://www.scmp.com/magazines/style/celebrity/article/3113111/shin-min-fame-how-k-drama-star-went-acting-k-pop-music,"data:image/gif;base64,R0lGODlhAQABAIAAAP///////yH5BAEKAAEALAAAAAABAAEAAAICTAEAOw==",0.0,0.1,0.4404
'Start Up' cast say goodbye to drama,The Independent,2 weeks ago,2020-12-10 16:48:28.378534,"South Korean TV drama, tvN's Start-Up has aired its final episode on ... Suzy plays Seo Dal Mi, an adventurer who aspires to become Korea's Steve Jobs while ...",https://theindependent.sg/start-up-cast-say-goodbye-to-drama/,"data:image/gif;base64,R0lGODlhAQABAIAAAP///////yH5BAEKAAEALAAAAAABAAEAAAICTAEAOw==",0.0,0.0,0.0
"#Showbiz: Msian drama series should stop copying K-drama, says Aqasha",New Straits Times Online,2 weeks ago,2020-12-10 16:48:28.373547,"KUALA LUMPUR: Actor-singer Aqasha has slammed some Malay TV drama series for blatantly copying Korean drama series, resulting in loss of own identity.",https://www.nst.com.my/lifestyle/groove/2020/12/648118/showbiz-msian-drama-series-should-stop-copying-k-drama-says-aqasha,"data:image/gif;base64,R0lGODlhAQABAIAAAP///////yH5BAEKAAEALAAAAAABAAEAAAICTAEAOw==",0.0,0.0,-0.296
How Netflix’s The Uncanny Counter pushes K-drama boundaries,South China Morning Post,2 weeks ago,2020-12-10 16:48:28.372550,"The scope of K-dramas is constantly expanding, and the latest television hit to make waves in South Korea is a demon hunter saga chock-full of action, thrills ...",https://www.scmp.com/lifestyle/k-pop/k-drama/article/3113486/netflix-series-uncanny-counter-k-drama-enters-new-territory,"data:image/gif;base64,R0lGODlhAQABAIAAAP///////yH5BAEKAAEALAAAAAABAAEAAAICTAEAOw==",0.0,0.0,0.0
All the K-drama feels: How I got hooked on ‘Start-Up’,INQUIRER.net,2 weeks ago,2020-12-10 16:48:28.369558,"MANILA, Philippines — Everyone who's very much into the world of K-drama knows that one of the most popular Korean television dramas of 2020 has come to ...",https://lifestyle.inquirer.net/376087/all-the-k-drama-feels-how-i-got-hooked-on-start-up/,"data:image/gif;base64,R0lGODlhAQABAIAAAP///////yH5BAEKAAEALAAAAAABAAEAAAICTAEAOw==",0.0,0.0,0.0
"Hyun Bin at Singapore River, Han Ye-seul's Orchard Road ...",AsiaOne,2 weeks ago,2020-12-10 16:48:27.111897,"Many K-drama fans would know World's Within as the drama which (allegedly) ... In the drama, Ye-Seul plays a North Korean spy on a mission to kidnap a South ...",https://www.asiaone.com/entertainment/hyun-bin-singapore-river-han-ye-seul-s-orchard-road-motorcycle-chase-iconic-k-drama,"data:image/gif;base64,R0lGODlhAQABAIAAAP///////yH5BAEKAAEALAAAAAABAAEAAAICTAEAOw==",0.0,0.0,0.0
K-drama lessons I've applied to real-life relationships,Jakarta Post,2 weeks ago,2020-12-10 16:48:25.797127,A lot of people I've met underestimate South Korean drama (or K-drama). A colleague of mine said that these TV dramas were too shallow and focused on weak ...,https://www.thejakartapost.com/paper/2020/12/08/k-drama-lessons-ive-applied-to-real-life-relationships.html,"data:image/gif;base64,R0lGODlhAQABAIAAAP///////yH5BAEKAAEALAAAAAABAAEAAAICTAEAOw==",0.0,0.0,0.0
Netflix stacked with K-dramas in 2021 – here’s what we know so far,South China Morning Post,2 weeks ago,2020-12-10 16:48:25.791144,"As 2020 winds down, anticipation for the new year builds, and so will Netflix's line-up of South Korean television shows. K-dramas starring some of the country's ...",https://www.scmp.com/lifestyle/k-pop/k-drama/article/3113609/netflix-korean-dramas-2021-gong-yoo-and-lee-joon-space,"data:image/gif;base64,R0lGODlhAQABAIAAAP///////yH5BAEKAAEALAAAAAABAAEAAAICTAEAOw==",0.1,1.0,0.0
K-drama review: Love and business are keys to 'Start Up ...,ABS-CBN News,2 weeks ago,2020-12-10 16:48:25.787154,"Of all the six K-drama series I had finished so far, this was probably the Episode 1 with the most emotional highlights right off the bat. Don't be surprised if you ...",https://news.abs-cbn.com/entertainment/12/07/20/k-drama-review-love-and-business-are-keys-to-start-up-success,"data:image/gif;base64,R0lGODlhAQABAIAAAP///////yH5BAEKAAEALAAAAAABAAEAAAICTAEAOw==",0.5,0.6,0.6369
"What Singaporeans watched on Netflix in 2020, Entertainment News & Top Stories",The Straits Times,2 weeks ago,2020-12-10 16:48:25.786157,K-dramas saw a surge in viewership of almost 200 per cent. The top K-drama title was the Lee Min-ho and Kim Go-eun vehicle The King: Eternal Monarch; and the ...,https://www.straitstimes.com/life/entertainment/what-singaporeans-watched-on-netflix-in-2020,"data:image/gif;base64,R0lGODlhAQABAIAAAP///////yH5BAEKAAEALAAAAAABAAEAAAICTAEAOw==",0.5,0.5,0.5574
K-Drama Adaptation of ‘Money Heist’ Announced By Netflix,What's on Netflix,2 weeks ago,2020-12-10 16:48:25.785159,The consumption of South Korean media has grown rapidly over the past decade and in particular for K-Drama series. Netflix has put a monumental amount of ...,https://www.whats-on-netflix.com/news/k-drama-adaptation-of-money-heist-announced-by-netflix/,"data:image/gif;base64,R0lGODlhAQABAIAAAP///////yH5BAEKAAEALAAAAAABAAEAAAICTAEAOw==",0.0,0.0,0.0
Singapore to be a backdrop in future K-dramas,CNA,2 weeks ago,2020-12-10 16:48:24.688228,"You'll be able to spot local places in future K-drama shows. 11 Dec 2020. Studio Dragon, the South Korean production house behind Crash Landing On You ...",https://cnalifestyle.channelnewsasia.com/trending/k-dramas-singapore-studio-dragon-stb-tourism-backdrop-13748764,"data:image/gif;base64,R0lGODlhAQABAIAAAP///////yH5BAEKAAEALAAAAAABAAEAAAICTAEAOw==",0.0,0.125,0.0
STB rides K-drama wave to promote Singapore,TTG Asia,2 weeks ago,2020-12-10 16:48:24.687231,"Filming of these Korean dramas, with Singapore as a backdrop, will begin when travel restrictions ease. During this process, STB will play an advisory role in ...",https://www.ttgasia.com/2020/12/09/stb-rides-k-drama-wave-to-promote-singapore/,"data:image/gif;base64,R0lGODlhAQABAIAAAP///////yH5BAEKAAEALAAAAAABAAEAAAICTAEAOw==",0.0,0.0,0.3818
The 13 Best Korean Dramas Of 2020,Forbes,2 weeks ago,2020-12-10 16:48:24.686233,"Every drama viewer may have a different list of favorites, but here are a few 2020 dramas that stood out in terms of originality, subject matter and execution. Park ...",https://www.forbes.com/sites/joanmacdonald/2020/12/11/the-13-best-korean-dramas-of-2020/,"data:image/gif;base64,R0lGODlhAQABAIAAAP///////yH5BAEKAAEALAAAAAABAAEAAAICTAEAOw==",1.0,0.3,0.6369
Singapore backdrop for K-dramas in the future,The Straits Times,2 weeks ago,2020-12-10 16:48:24.685236,The deal will promote Singapore as a destination in South Korea and other regions through the production of South Korean dramas in Singapore. Though the ...,https://www.straitstimes.com/life/entertainment/singapore-backdrop-for-k-dramas-in-the-future,"data:image/gif;base64,R0lGODlhAQABAIAAAP///////yH5BAEKAAEALAAAAAABAAEAAAICTAEAOw==",0.0,0.125,0.0
"Lee Min Ho, Park Seo Joon or Hyun Bin, who was the Best K drama actor of the year? VOTE",PINKVILLA,3 weeks ago,2020-12-03 16:48:29.509960,It was an interesting year for K-drama lovers. An array of dramas made its way on the small screen. As the COVID-19 induced lockdown forced people to go ...,https://www.pinkvilla.com/entertainment/lee-min-ho-park-seo-joon-or-hyun-bin-who-was-best-k-drama-actor-year-vote-579512,"data:image/gif;base64,R0lGODlhAQABAIAAAP///////yH5BAEKAAEALAAAAAABAAEAAAICTAEAOw==",1.0,0.3,0.6369
Readers’ comments: ‘Your article helps me understand my addiction to Korean dramas’,Scroll.in,3 weeks ago,2020-12-03 16:48:27.121874,I am so moved by these heartwarming K-dramas that now I actually want to visit ... I have watched lots of Korean dramas and your article reflects my thoughts.,https://scroll.in/article/980217/readers-comments-your-article-helps-me-understand-my-addiction-to-korean-dramas,"data:image/gif;base64,R0lGODlhAQABAIAAAP///////yH5BAEKAAEALAAAAAABAAEAAAICTAEAOw==",0.0,0.0,0.3818
"In this Indian city, locals love K-pop and Koreans love Indian food",South China Morning Post,3 weeks ago,2020-12-03 16:48:27.114887,"In this Indian city, locals love K-pop and K-dramas while Koreans love Indian food and weather – but not the doctors. Chennai has the largest South Korean ...",https://www.scmp.com/lifestyle/travel-leisure/article/3111914/indian-city-locals-love-k-pop-and-k-dramas-while-koreans,"data:image/gif;base64,R0lGODlhAQABAIAAAP///////yH5BAEKAAEALAAAAAABAAEAAAICTAEAOw==",0.5,0.6,0.8555
Before BL K-drama Color Rush: 5 more Korean LGBT movies and shows,South China Morning Post,3 weeks ago,2020-12-03 16:48:25.798124,"He debuted as a solo act this summer and now he's set to star in his first K-drama, which will premiere internationally before the end of 2020. Color Rush is a boy's ...",https://www.scmp.com/magazines/style/celebrity/article/3112538/boyzs-hur-hyunjun-debuts-new-bl-k-drama-color-rush-heres,"data:image/gif;base64,R0lGODlhAQABAIAAAP///////yH5BAEKAAEALAAAAAABAAEAAAICTAEAOw==",0.5,0.5,0.6166
"iQiyi International to produce first K-drama, Entertainment News & Top Stories",The Straits Times,3 weeks ago,2020-12-03 16:48:25.793138,"Chinese streaming giant iQiyi's global arm iQiyi International will produce a K-drama for the first time, it announced at the Asia TV Forum and Market (ATF) ...",https://www.straitstimes.com/life/entertainment/iqiyi-international-to-produce-first-k-drama,"data:image/gif;base64,R0lGODlhAQABAIAAAP///////yH5BAEKAAEALAAAAAABAAEAAAICTAEAOw==",0.25,0.27777777777777773,0.5574
iQiyi International to produce K-drama My Roommate Is A ...,The Straits Times,3 weeks ago,2020-12-03 16:48:24.683241,"SINGAPORE - Chinese streaming giant international arm, iQiyi International, iQiyi International, will be producing a K-drama for the first time, it announced at the ...",https://www.straitstimes.com/life/entertainment/chinese-streaming-giant-iqiyi-to-produce-k-drama-my-roommate-is-a-gumiho,"data:image/gif;base64,R0lGODlhAQABAIAAAP///////yH5BAEKAAEALAAAAAABAAEAAAICTAEAOw==",0.0,0.0,0.0
